{
  "schema": 1,
  "planId": "plan-interaction-button",
  "revision": 1,
  "flow": {
    "path": "interaction-button.md",
    "digest": "d29ef0c7ba89c338c3ae58f079b92e8c4ac8ed0ca161a57b68724def8195fd56"
  },
  "title": "interaction-button",
  "goal": "Replay the committed interaction-button flow against the sample app.",
  "scenarios": [],
  "assumptions": [],
  "risks": [],
  "preconditions": [],
  "reset": {
    "required": false
  },
  "acceptanceCriteria": [],
  "requiredPlatforms": [],
  "requirements": {
    "requiredCapabilities": [],
    "requiredSemantics": []
  },
  "prohibitedActionClasses": [],
  "provenance": {
    "actorKind": "human",
    "channel": "repository",
    "intent": "human-authored"
  },
  "reviews": [],
  "approvals": [],
  "sideEffectPolicy": "none",
  "businessOracles": [],
  "independentBusinessOracles": []
}
