{
  "schema": 1,
  "planId": "plan-native-add-todo",
  "revision": 1,
  "flow": {
    "path": "native-add-todo.md",
    "digest": "48a55fff92aa6724666bcabc0a072c38113dfe12574abeb53ab4835d6adc8be4"
  },
  "title": "native-add-todo",
  "goal": "Replay the committed native-add-todo flow against the sample app.",
  "scenarios": [],
  "assumptions": [],
  "risks": [],
  "preconditions": [],
  "reset": {
    "required": false
  },
  "acceptanceCriteria": [],
  "requiredPlatforms": [],
  "requirements": {
    "requiredCapabilities": [],
    "requiredSemantics": []
  },
  "prohibitedActionClasses": [],
  "provenance": {
    "actorKind": "human",
    "channel": "repository",
    "intent": "human-authored"
  },
  "reviews": [],
  "approvals": [],
  "sideEffectPolicy": "none",
  "businessOracles": [],
  "independentBusinessOracles": []
}
