{
  "schema": 1,
  "planId": "plan-appkit-shell-navigation",
  "revision": 1,
  "flow": {
    "path": "appkit-shell-navigation.md",
    "digest": "a97843fcb02c0bd2168c526429afa76eb63917aa56fbc363fe358c3daf3c9db5"
  },
  "title": "appkit-shell-navigation",
  "goal": "Replay the committed appkit-shell-navigation flow against the sample app.",
  "scenarios": [],
  "assumptions": [],
  "risks": [],
  "preconditions": [],
  "reset": {
    "required": false
  },
  "acceptanceCriteria": [],
  "requiredPlatforms": [],
  "requirements": {
    "requiredCapabilities": [],
    "requiredSemantics": []
  },
  "prohibitedActionClasses": [],
  "provenance": {
    "actorKind": "human",
    "channel": "repository",
    "intent": "human-authored"
  },
  "reviews": [],
  "approvals": [],
  "sideEffectPolicy": "none",
  "businessOracles": [],
  "independentBusinessOracles": []
}
