{
  "schema": 1,
  "planId": "plan-interaction-command-tap",
  "revision": 1,
  "flow": {
    "path": "interaction-command-tap.md",
    "digest": "c81b3eb8664e717581b0ea19962378f6d88b3566a7ccc20461406abf4cbf4134"
  },
  "title": "interaction-command-tap",
  "goal": "Replay the committed interaction-command-tap flow against the sample app.",
  "scenarios": [],
  "assumptions": [],
  "risks": [],
  "preconditions": [],
  "reset": {
    "required": false
  },
  "acceptanceCriteria": [],
  "requiredPlatforms": [],
  "requirements": {
    "requiredCapabilities": [],
    "requiredSemantics": []
  },
  "prohibitedActionClasses": [],
  "provenance": {
    "actorKind": "human",
    "channel": "repository",
    "intent": "human-authored"
  },
  "reviews": [],
  "approvals": [],
  "sideEffectPolicy": "none",
  "businessOracles": [],
  "independentBusinessOracles": []
}
